lang_id,level,word,meaning,example
1,1,action,"행동, 조치",The police took quick action to stop the fire.
1,1,activity,활동,Swimming is her favorite activity.
1,1,actor,배우(남),He wants to be an actor.
1,1,actress,배우(여),She is a famous actress.
1,1,address,주소,Can you tell me your address?
1,1,adult,"성인, 어른",This movie is only for adults.
1,1,advice,조언,My teacher gave me good advice.
1,1,afraid,무서워하는,I am afraid of dogs.
1,1,afternoon,오후,We will meet in the afternoon.
1,1,agree,동의하다,I agree with your idea.
1,1,air,공기,The air here is very clean.
1,1,airport,공항,We arrived at the airport early.
1,1,angry,화난,She was angry with her brother.
1,1,animal,동물,Lions are wild animals.
1,1,answer,"대답, 답",Please write your answer here.
1,1,apartment,아파트,They live in a small apartment.
1,1,apple,사과,I ate an apple for breakfast.
1,1,area,"지역, 구역",This is a quiet area of the city.
1,1,arm,팔,He broke his arm last week.
1,1,arrive,도착하다,The train will arrive at noon.
1,1,art,"미술, 예술",She studies art at school.
1,1,artist,"예술가, 화가",He is a talented artist.
1,1,aunt,"이모, 고모",My aunt lives in Seoul.
1,1,baby,아기,The baby is sleeping now.
1,1,bag,가방,I put my books in my bag.
1,1,ball,공,The children are playing with a ball.
1,1,banana,바나나,She had a banana for a snack.
1,1,bath,목욕,He takes a bath every night.
1,1,bathroom,"욕실, 화장실",The bathroom is upstairs.
1,1,beach,해변,We spent the day at the beach.
1,1,beautiful,아름다운,The sunset was beautiful.
1,1,bed,침대,She is lying on the bed.
1,1,bedroom,침실,My bedroom is very small.
1,1,begin,시작하다,The class will begin at nine.
1,1,believe,믿다,I believe you.
1,1,bicycle,자전거,He rides his bicycle to school.
1,1,bird,새,A bird is singing outside.
1,1,birthday,생일,Today is my birthday.
1,1,book,책,She is reading a book.
1,1,bottle,병,He drank a bottle of water.
1,2,ability,능력,She has the ability to solve hard problems.
1,2,accident,사고,There was a car accident this morning.
1,2,achieve,"성취하다, 이루다",He worked hard to achieve his goal.
1,2,active,활동적인,My grandmother is very active for her age.
1,2,adventure,모험,They went on an adventure in the mountains.
1,2,advantage,"장점, 이점",Speaking two languages is a big advantage.
1,2,airline,항공사,She works for a large airline.
1,2,ankle,발목,He hurt his ankle while running.
1,2,apply,"지원하다, 신청하다",I plan to apply for the job.
1,2,architect,건축가,Her father is an architect.
1,2,argue,"다투다, 논쟁하다",The two brothers often argue about small things.
1,2,army,군대,He joined the army last year.
1,2,assistant,"조수, 보조원",She works as a manager's assistant.
1,2,athlete,운동선수,The athlete trains every morning.
1,2,attack,공격,The soldiers prepared for an attack.
1,2,attend,참석하다,All students must attend the meeting.
1,2,attractive,매력적인,He has an attractive smile.
1,2,audience,"청중, 관객",The audience clapped loudly.
1,2,author,"작가, 저자",She is the author of this book.
1,2,award,상,He won an award for his painting.
1,2,background,배경,The photo has a blue background.
1,2,bear,곰,We saw a bear in the forest.
1,2,beat,"이기다, 두드리다",Our team beat the other team easily.
1,2,behavior,"행동, 태도",His behavior surprised everyone.
1,2,belong,속하다,This book belongs to me.
1,2,benefit,"혜택, 이익",Exercise has many benefits.
1,2,biology,생물학,She is studying biology at university.
1,2,birth,출생,The baby's birth was on Monday.
1,2,blank,"빈, 백지의",Please fill in the blank space.
1,2,block,"구역, 막다",The building is two blocks away.
1,2,blood,피,The doctor checked his blood pressure.
1,2,blow,불다,The wind began to blow hard.
1,2,board,"판, 이사회",He wrote the answer on the board.
1,2,boil,끓이다,She boiled some water for tea.
1,2,bone,뼈,The dog is chewing a bone.
1,2,borrow,빌리다,Can I borrow your pen?
1,2,boss,"상사, 사장",My boss is very kind.
1,2,bottom,"바닥, 맨 아래",The keys are at the bottom of the bag.
1,2,bowl,그릇,She filled the bowl with soup.
1,2,brain,뇌,The brain controls the whole body.
1,3,absolutely,"전적으로, 완전히",I absolutely agree with you.
1,3,academic,"학업의, 학문적인",He has a strong academic record.
1,3,access,"접근, 이용",Students have access to the library.
1,3,account,"계좌, 계정",She opened a bank account.
1,3,achievement,"성취, 업적",Winning the prize was a great achievement.
1,3,admire,"존경하다, 감탄하다",I really admire her courage.
1,3,admit,인정하다,He admitted his mistake.
1,3,advise,조언하다,The doctor advised him to rest.
1,3,afford,"여유가 있다, 감당하다",We can't afford a new car right now.
1,3,agent,"대리인, 중개인",She works as a travel agent.
1,3,agreement,"합의, 협정",The two companies signed an agreement.
1,3,alarm,"경보, 알람",The alarm went off at six.
1,3,album,앨범,He released a new music album.
1,3,alcohol,"술, 알코올",He doesn't drink alcohol.
1,3,ambition,"야망, 포부",Her ambition is to become a doctor.
1,3,analysis,분석,The report contains a detailed analysis.
1,3,announce,발표하다,The teacher announced the test date.
1,3,annoy,짜증나게 하다,The noise began to annoy him.
1,3,apologize,사과하다,She apologized for being late.
1,3,application,"지원서, 신청서",He submitted his job application.
1,3,appointment,"약속, 예약",I have a doctor's appointment tomorrow.
1,3,appreciate,"감사하다, 진가를 알다",I really appreciate your help.
1,3,arrest,체포하다,The police arrested the thief.
1,3,arrival,도착,We waited for her arrival.
1,3,assignment,과제,The teacher gave us a new assignment.
1,3,atmosphere,"분위기, 대기",The party had a relaxed atmosphere.
1,3,attach,"첨부하다, 붙이다",Please attach the file to your email.
1,3,attitude,태도,He has a positive attitude toward work.
1,3,attract,끌어들이다,The museum attracts many tourists.
1,3,attraction,"명소, 매력",The castle is a popular tourist attraction.
1,3,authority,"권위, 당국",The city authority closed the road.
1,3,automatic,자동의,This door is automatic.
1,3,aware,"알고 있는, 인식하는",She is aware of the problem.
1,3,backward,뒤로,He took a step backward.
1,3,bake,굽다,My mother likes to bake bread.
1,3,balance,균형,It's hard to keep your balance on ice.
1,3,ban,금지하다,The city banned smoking in parks.
1,3,base,"기초, 토대",The theory has a solid base.
1,3,battery,배터리,My phone battery is low.
1,3,battle,전투,The soldiers fought a long battle.
1,4,abandon,"버리다, 포기하다",They had to abandon the plan.
1,4,abroad,해외에,She studied abroad for two years.
1,4,absolute,절대적인,There is no absolute answer to this question.
1,4,acceptable,받아들일 수 있는,Being late is not acceptable.
1,4,accompany,"동반하다, 동행하다",He accompanied his sister to the airport.
1,4,accurate,정확한,Please give me accurate information.
1,4,accuse,"비난하다, 고발하다",They accused him of lying.
1,4,acknowledge,인정하다,She acknowledged her mistake.
1,4,acquire,"습득하다, 얻다",Children acquire language quickly.
1,4,actual,실제의,The actual cost was higher than expected.
1,4,adapt,적응하다,It took time for him to adapt to the new school.
1,4,additional,추가의,We need additional information.
1,4,adopt,"채택하다, 입양하다",The company adopted a new policy.
1,4,advance,"발전, 진보",There has been great advance in technology.
1,4,affair,"사건, 일",The trial became a national affair.
1,4,afterward,나중에,We had dinner and went for a walk afterward.
1,4,agency,"대행사, 기관",She works at an advertising agency.
1,4,agenda,"안건, 의제",The meeting agenda has five items.
1,4,aggressive,공격적인,The dog became aggressive when scared.
1,4,aid,"원조, 도움",The country received foreign aid.
1,4,aircraft,항공기,The aircraft landed safely.
1,4,alter,"바꾸다, 변경하다",They altered their travel plans.
1,4,amount,"양, 액수",A large amount of money was spent.
1,4,anger,분노,He couldn't hide his anger.
1,4,angle,각도,Look at the photo from a different angle.
1,4,anniversary,기념일,Today is their wedding anniversary.
1,4,annual,"매년의, 연례의",The company holds an annual meeting.
1,4,anxious,"불안한, 걱정하는",She felt anxious before the exam.
1,4,apparent,명백한,It was apparent that he was upset.
1,4,apparently,"명백히, 보아하니","Apparently, the train was delayed."
1,4,appeal,"호소하다, 매력",The idea appeals to many young people.
1,4,approach,"접근하다, 접근법",We need a new approach to this problem.
1,4,appropriate,적절한,Wear appropriate clothes for the interview.
1,4,approval,승인,The plan needs the manager's approval.
1,4,approve,승인하다,The board approved the new budget.
1,4,arise,발생하다,A problem arose during the meeting.
1,4,armed,무장한,Armed guards stood at the gate.
1,4,arms,무기,The country reduced its arms spending.
1,4,artificial,인공적인,The lake has artificial lighting at night.
1,4,ashamed,부끄러운,He felt ashamed of his behavior.
1,5,abolish,폐지하다,The government decided to abolish the old law.
1,5,abortion,낙태,The debate on abortion continues in politics.
1,5,absence,"부재, 결석",Her absence was noticed by everyone.
1,5,absent,"결석한, 없는",He was absent from class yesterday.
1,5,absurd,터무니없는,The idea seemed absurd at first.
1,5,abuse,"남용, 학대",The report described the abuse of power.
1,5,academy,"학원, 학회",She trains at a football academy.
1,5,accelerate,가속하다,The car began to accelerate quickly.
1,5,acceptance,"수용, 승낙",He received an acceptance letter from the university.
1,5,accessible,접근 가능한,The building is accessible to everyone.
1,5,accomplishment,"성취, 업적",Graduating early was a great accomplishment.
1,5,accordingly,그에 따라,"The plan failed, so we acted accordingly."
1,5,accountability,책임(성),The company promised more accountability.
1,5,accountable,책임이 있는,Leaders should be accountable for their actions.
1,5,accumulate,"축적하다, 쌓이다",Dust began to accumulate on the shelf.
1,5,accusation,"비난, 고발",He denied the accusation completely.
1,5,acute,"급성의, 예리한",The patient felt an acute pain in his chest.
1,5,adaptation,"각색, 적응",The movie is an adaptation of the novel.
1,5,adhere,"고수하다, 준수하다",Employees must adhere to the rules.
1,5,adjacent,인접한,The hotel is adjacent to the train station.
1,5,adjustment,"조정, 적응",The plan needs a small adjustment.
1,5,administer,"관리하다, 집행하다",The nurse administered the medicine.
1,5,administrative,행정의,She handles the administrative work.
1,5,administrator,"관리자, 행정관",He works as a system administrator.
1,5,admission,"입장, 입학",Admission to the museum is free.
1,5,adolescent,청소년(의),The clinic treats adolescent patients.
1,5,adoption,"입양, 채택",The couple is considering adoption.
1,5,adverse,"불리한, 부정적인",The medicine may have adverse effects.
1,5,advocate,"옹호자, 옹호하다",She is an advocate for children's rights.
1,5,aesthetic,미적인,The design has a modern aesthetic.
1,5,affection,애정,He showed great affection for his dog.
1,5,aftermath,여파,The city rebuilt in the aftermath of the storm.
1,5,aggression,공격성,The report studied aggression in children.
1,5,agricultural,농업의,The region relies on agricultural products.
1,5,alert,"경계하는, 경보",Stay alert while driving at night.
1,5,alien,"외계인, 외국의",The movie is about an alien invasion.
1,5,align,"정렬하다, 일치시키다",We need to align our goals with the company's.
1,5,alike,"비슷한, 똑같이",The two sisters look alike.
1,5,allegation,"주장, 혐의",The company denied the allegation.
1,5,alliance,동맹,The two nations formed an alliance.
1,6,ubiquitous,"어디에나 있는, 편재하는",Smartphones have become ubiquitous in modern society.
1,6,ambiguous,"애매한, 모호한",His answer was deliberately ambiguous.
1,6,paradigm,"패러다임, 전형적인 예",The discovery represented a paradigm shift in physics.
1,6,quintessential,전형적인,She is the quintessential example of a modern leader.
1,6,esoteric,"소수만 이해하는, 난해한",The lecture covered some rather esoteric topics in philosophy.
1,6,ephemeral,"일시적인, 덧없는",Fame in this industry can be ephemeral.
1,6,transient,"일시적인, 순간적인",The population of the town is largely transient.
1,6,austere,"엄격한, 소박한",He lived an austere life with few possessions.
1,6,candid,솔직한,She gave a candid account of what happened.
1,6,meticulous,"꼼꼼한, 세심한",The scientist kept meticulous records of every experiment.
1,6,resilient,회복력 있는,Children can be remarkably resilient after difficult experiences.
1,6,plausible,"그럴듯한, 타당한 것 같은",His explanation seemed plausible at first.
1,6,discern,"분별하다, 알아차리다",It was hard to discern any pattern in the data.
1,6,eloquent,"웅변적인, 유창한",The speaker gave an eloquent speech about justice.
1,6,tangible,"실체적인, 명백한",There is no tangible evidence to support the claim.
1,6,coherent,"일관성 있는, 조리 있는",She presented a coherent argument for the reform.
1,6,juxtapose,"나란히 놓다, 병치하다",The exhibit juxtaposes old photographs with modern art.
1,6,nuance,"뉘앙스, 미묘한 차이",Translating poetry requires attention to every nuance.
1,6,dichotomy,이분법,There is a clear dichotomy between theory and practice.
1,6,connotation,함축된 의미,The word has a negative connotation in this context.
1,6,obsolete,"구식의, 폐물이 된",This technology quickly became obsolete.
1,6,redundant,"불필요한, 군더더기의",Several parts of the report were redundant.
1,6,anomaly,"이례, 예외",The result was an anomaly that scientists could not explain.
1,6,paradox,역설,"It's a paradox that the more we know, the more we realize we don't know."
1,6,pragmatic,실용적인,"We need a pragmatic solution, not an idealistic one."
1,6,insinuate,"넌지시 말하다, 암시하다",He insinuated that she had lied without saying it directly.
1,6,vindicate,정당성을 입증하다,New evidence eventually vindicated her claims.
1,6,exacerbate,악화시키다,The drought exacerbated the food shortage.
1,6,capitulate,"굴복하다, 항복하다",The army refused to capitulate despite heavy losses.
1,6,equivocal,"애매한, 이중적인",His statement was equivocal and satisfied no one.
1,6,perfunctory,"형식적인, 성의 없는",He gave a perfunctory apology and left.
1,6,surreptitious,"은밀한, 몰래 하는",She took a surreptitious glance at her phone during the meeting.
1,6,gratuitous,"불필요한, 근거 없는",The movie was criticized for its gratuitous violence.
1,6,inexorable,"멈출 수 없는, 가차없는",The company's decline seemed inexorable.
1,6,circumvent,"회피하다, 우회하다",They found a way to circumvent the regulations.
1,6,deference,"존경, 경의",The students showed deference to their professor.
1,6,conundrum,"난제, 수수께끼",The puzzle presented a real conundrum for the team.
1,6,antithesis,"정반대, 대조",Her calm behavior was the antithesis of panic.
1,6,cognizant,인지하고 있는,He was fully cognizant of the risks involved.
1,6,divulge,"누설하다, 폭로하다",The lawyer refused to divulge any details of the case.
